{"schemaVersion":"release-ops/adapter/v2","id":"unity","status":"credential-gated","docs":"docs/stacks/unity.md","detects":["ProjectSettings/ProjectVersion.txt"],"artifactTypes":["player-package"],"debugArtifactTypes":["source-map","proguard","dif"],"targets":[{"id":"linux","runner":"ubuntu-latest"},{"id":"web","runner":"ubuntu-latest"},{"id":"android","runner":"ubuntu-latest"},{"id":"windows","runner":"windows-latest"},{"id":"macos","runner":"macos-latest"},{"id":"ios","runner":"macos-latest"}],"credentialProfiles":{"personal":["UNITY_LICENSE","UNITY_EMAIL","UNITY_PASSWORD"],"professional":["UNITY_SERIAL","UNITY_EMAIL","UNITY_PASSWORD"]},"selfHostedFallback":true,"selfHostedConditions":["proprietary-console-sdk","restricted-module","license-not-usable-on-hosted-runner"]}
