{"schemaVersion":"release-ops/adapter/v2","id":"javascript","status":"supported","docs":"docs/stacks/javascript.md","detects":["package.json"],"artifactTypes":["bundle","package"],"debugArtifactTypes":["source-map"],"targets":[{"id":"web","runner":"ubuntu-latest"},{"id":"linux","runner":"ubuntu-latest"},{"id":"windows","runner":"windows-latest"},{"id":"macos","runner":"macos-latest"}]}
