{"schemaVersion":"release-ops/adapter/v2","id":"flutter","status":"supported","docs":"docs/stacks/flutter.md","detects":["pubspec.yaml"],"artifactTypes":["platform-package"],"debugArtifactTypes":["dart-symbol","source-map","dif"],"targets":[{"id":"android","runner":"ubuntu-latest"},{"id":"web","runner":"ubuntu-latest"},{"id":"linux","runner":"ubuntu-latest"},{"id":"windows","runner":"windows-latest"},{"id":"ios","runner":"macos-latest"},{"id":"macos","runner":"macos-latest"}]}
