{"schemaVersion":"release-ops/adapter/v2","id":"native","status":"supported","docs":"docs/stacks/native.md","detects":["CMakeLists.txt","meson.build","Cargo.toml"],"artifactTypes":["binary"],"debugArtifactTypes":["dif"],"targets":[{"id":"linux","runner":"ubuntu-latest"},{"id":"windows","runner":"windows-latest"},{"id":"macos","runner":"macos-latest"}],"selfHostedFallback":true,"selfHostedConditions":["custom-compiler-or-sdk","licensed-cross-compiler"]}
