{"schemaVersion":"release-ops/adapter/v2","id":"godot","status":"supported","docs":"docs/stacks/godot.md","detects":["project.godot"],"artifactTypes":["export-package"],"debugArtifactTypes":["source-map","dif"],"targets":[{"id":"linux","runner":"ubuntu-latest"},{"id":"web","runner":"ubuntu-latest"},{"id":"android","runner":"ubuntu-latest"},{"id":"windows","runner":"windows-latest"},{"id":"macos","runner":"macos-latest"},{"id":"ios","runner":"macos-latest"}],"selfHostedFallback":true,"selfHostedConditions":["proprietary-console-sdk","custom-engine-build","toolchain-not-legally-deployable","host-sdk-or-signing-unavailable"]}
